04:49:08.994823 IP (tos 0x0, ttl 64, id 22430, offset 0, flags [DF], proto TCP (6), length 60)
    ksat-api-sv-1.c.syns-sol-grdsys-internal-prod.internal.36496 > 192.146.239.16.amqps: Flags [S], cksum 0xe269 (incorrect -> 0x6272), seq 1284302955, win 65320, options [mss 1420,sackOK,TS val 1366022454 ecr 0,nop,wscale 7], length 0
04:49:09.260017 IP (tos 0x0, ttl 35, id 0, offset 0, flags [DF], proto TCP (6), length 60)
    192.146.239.16.amqps > ksat-api-sv-1.c.syns-sol-grdsys-internal-prod.internal.36496: Flags [S.], cksum 0x3c96 (correct), seq 862936446, ack 1284302956, win 28960, options [mss 1460,sackOK,TS val 96279809 ecr 1366022454,nop,wscale 7], length 0
04:49:09.260149 IP (tos 0x0, ttl 64, id 22431, offset 0, flags [DF], proto TCP (6), length 52)
    ksat-api-sv-1.c.syns-sol-grdsys-internal-prod.internal.36496 > 192.146.239.16.amqps: Flags [.], cksum 0xe261 (incorrect -> 0xd97a), seq 1, ack 1, win 511, options [nop,nop,TS val 1366022719 ecr 96279809], length 0
04:49:09.260383 IP (tos 0x0, ttl 64, id 22432, offset 0, flags [DF], proto TCP (6), length 263)
    ksat-api-sv-1.c.syns-sol-grdsys-internal-prod.internal.36496 > 192.146.239.16.amqps: Flags [P.], cksum 0xe334 (incorrect -> 0xb7fe), seq 1:212, ack 1, win 511, options [nop,nop,TS val 1366022719 ecr 96279809], length 211
04:49:09.528162 IP (tos 0x0, ttl 35, id 16443, offset 0, flags [DF], proto TCP (6), length 1460)
    192.146.239.16.amqps > ksat-api-sv-1.c.syns-sol-grdsys-internal-prod.internal.36496: Flags [.], cksum 0xc7ed (correct), seq 1:1409, ack 212, win 235, options [nop,nop,TS val 96279876 ecr 1366022719], length 1408
04:49:09.528236 IP (tos 0x0, ttl 64, id 22433, offset 0, flags [DF], proto TCP (6), length 52)
    ksat-api-sv-1.c.syns-sol-grdsys-internal-prod.internal.36496 > 192.146.239.16.amqps: Flags [.], cksum 0xe261 (incorrect -> 0xd1e2), seq 212, ack 1409, win 501, options [nop,nop,TS val 1366022987 ecr 96279876], length 0
04:49:09.528256 IP (tos 0x0, ttl 35, id 16444, offset 0, flags [DF], proto TCP (6), length 2107)
    192.146.239.16.amqps > ksat-api-sv-1.c.syns-sol-grdsys-internal-prod.internal.36496: Flags [P.], cksum 0xea68 (incorrect -> 0xbc5b), seq 1409:3464, ack 212, win 235, options [nop,nop,TS val 96279876 ecr 1366022719], length 2055
04:49:09.528265 IP (tos 0x0, ttl 64, id 22434, offset 0, flags [DF], proto TCP (6), length 52)
    ksat-api-sv-1.c.syns-sol-grdsys-internal-prod.internal.36496 > 192.146.239.16.amqps: Flags [.], cksum 0xe261 (incorrect -> 0xc9e9), seq 212, ack 3464, win 487, options [nop,nop,TS val 1366022987 ecr 96279876], length 0
04:49:09.581184 IP (tos 0x0, ttl 64, id 22435, offset 0, flags [DF], proto TCP (6), length 178)
    ksat-api-sv-1.c.syns-sol-grdsys-internal-prod.internal.36496 > 192.146.239.16.amqps: Flags [P.], cksum 0xe2df (incorrect -> 0x266c), seq 212:338, ack 3464, win 501, options [nop,nop,TS val 1366023040 ecr 96279876], length 126
04:49:09.846512 IP (tos 0x0, ttl 35, id 16446, offset 0, flags [DF], proto TCP (6), length 103)
    192.146.239.16.amqps > ksat-api-sv-1.c.syns-sol-grdsys-internal-prod.internal.36496: Flags [P.], cksum 0xcf32 (correct), seq 3464:3515, ack 338, win 235, options [nop,nop,TS val 96279956 ecr 1366023040], length 51
04:49:09.846557 IP (tos 0x0, ttl 64, id 22436, offset 0, flags [DF], proto TCP (6), length 52)
    ksat-api-sv-1.c.syns-sol-grdsys-internal-prod.internal.36496 > 192.146.239.16.amqps: Flags [.], cksum 0xe261 (incorrect -> 0xc79b), seq 338, ack 3515, win 501, options [nop,nop,TS val 1366023306 ecr 96279956], length 0
04:49:09.846853 IP (tos 0x0, ttl 64, id 22437, offset 0, flags [DF], proto TCP (6), length 89)
    ksat-api-sv-1.c.syns-sol-grdsys-internal-prod.internal.36496 > 192.146.239.16.amqps: Flags [P.], cksum 0xe286 (incorrect -> 0x45d0), seq 338:375, ack 3515, win 501, options [nop,nop,TS val 1366023306 ecr 96279956], length 37
04:49:10.113859 IP (tos 0x0, ttl 35, id 16447, offset 0, flags [DF], proto TCP (6), length 610)
    192.146.239.16.amqps > ksat-api-sv-1.c.syns-sol-grdsys-internal-prod.internal.36496: Flags [P.], cksum 0xec39 (correct), seq 3515:4073, ack 375, win 235, options [nop,nop,TS val 96280023 ecr 1366023306], length 558
04:49:10.113901 IP (tos 0x0, ttl 64, id 22438, offset 0, flags [DF], proto TCP (6), length 52)
    ksat-api-sv-1.c.syns-sol-grdsys-internal-prod.internal.36496 > 192.146.239.16.amqps: Flags [.], cksum 0xe261 (incorrect -> 0xc3fa), seq 375, ack 4073, win 501, options [nop,nop,TS val 1366023573 ecr 96280023], length 0
04:49:10.114203 IP (tos 0x0, ttl 64, id 22439, offset 0, flags [DF], proto TCP (6), length 272)
    ksat-api-sv-1.c.syns-sol-grdsys-internal-prod.internal.36496 > 192.146.239.16.amqps: Flags [P.], cksum 0xe33d (incorrect -> 0xf23d), seq 375:595, ack 4073, win 501, options [nop,nop,TS val 1366023573 ecr 96280023], length 220
04:49:10.379109 IP (tos 0x0, ttl 35, id 16448, offset 0, flags [DF], proto TCP (6), length 101)
    192.146.239.16.amqps > ksat-api-sv-1.c.syns-sol-grdsys-internal-prod.internal.36496: Flags [P.], cksum 0xba9d (correct), seq 4073:4122, ack 595, win 243, options [nop,nop,TS val 96280089 ecr 1366023573], length 49
04:49:10.379158 IP (tos 0x0, ttl 64, id 22440, offset 0, flags [DF], proto TCP (6), length 52)
    ksat-api-sv-1.c.syns-sol-grdsys-internal-prod.internal.36496 > 192.146.239.16.amqps: Flags [.], cksum 0xe261 (incorrect -> 0xc1a2), seq 595, ack 4122, win 501, options [nop,nop,TS val 1366023838 ecr 96280089], length 0
04:49:10.379390 IP (tos 0x0, ttl 64, id 22441, offset 0, flags [DF], proto TCP (6), length 101)
    ksat-api-sv-1.c.syns-sol-grdsys-internal-prod.internal.36496 > 192.146.239.16.amqps: Flags [P.], cksum 0xe292 (incorrect -> 0xcc99), seq 595:644, ack 4122, win 501, options [nop,nop,TS val 1366023838 ecr 96280089], length 49
04:49:10.379412 IP (tos 0x0, ttl 64, id 22442, offset 0, flags [DF], proto TCP (6), length 111)
    ksat-api-sv-1.c.syns-sol-grdsys-internal-prod.internal.36496 > 192.146.239.16.amqps: Flags [P.], cksum 0xe29c (incorrect -> 0x7e28), seq 644:703, ack 4122, win 501, options [nop,nop,TS val 1366023838 ecr 96280089], length 59
04:49:10.643591 IP (tos 0x0, ttl 35, id 16449, offset 0, flags [DF], proto TCP (6), length 52)
    192.146.239.16.amqps > ksat-api-sv-1.c.syns-sol-grdsys-internal-prod.internal.36496: Flags [.], cksum 0xc1f6 (correct), seq 4122, ack 703, win 243, options [nop,nop,TS val 96280155 ecr 1366023838], length 0
04:49:10.644770 IP (tos 0x0, ttl 35, id 16450, offset 0, flags [DF], proto TCP (6), length 94)
    192.146.239.16.amqps > ksat-api-sv-1.c.syns-sol-grdsys-internal-prod.internal.36496: Flags [P.], cksum 0x1c5a (correct), seq 4122:4164, ack 703, win 243, options [nop,nop,TS val 96280156 ecr 1366023838], length 42
04:49:10.645011 IP (tos 0x0, ttl 64, id 22443, offset 0, flags [DF], proto TCP (6), length 94)
    ksat-api-sv-1.c.syns-sol-grdsys-internal-prod.internal.36496 > 192.146.239.16.amqps: Flags [P.], cksum 0xe28b (incorrect -> 0xd709), seq 703:745, ack 4164, win 501, options [nop,nop,TS val 1366024104 ecr 96280156], length 42
04:49:10.910511 IP (tos 0x0, ttl 35, id 16451, offset 0, flags [DF], proto TCP (6), length 97)
    192.146.239.16.amqps > ksat-api-sv-1.c.syns-sol-grdsys-internal-prod.internal.36496: Flags [P.], cksum 0x7d0f (correct), seq 4164:4209, ack 745, win 243, options [nop,nop,TS val 96280222 ecr 1366024104], length 45
04:49:10.910984 IP (tos 0x0, ttl 64, id 22444, offset 0, flags [DF], proto TCP (6), length 107)
    ksat-api-sv-1.c.syns-sol-grdsys-internal-prod.internal.36496 > 192.146.239.16.amqps: Flags [P.], cksum 0xe298 (incorrect -> 0xeb12), seq 745:800, ack 4209, win 501, options [nop,nop,TS val 1366024370 ecr 96280222], length 55
04:49:11.177723 IP (tos 0x0, ttl 35, id 16452, offset 0, flags [DF], proto TCP (6), length 108)
    192.146.239.16.amqps > ksat-api-sv-1.c.syns-sol-grdsys-internal-prod.internal.36496: Flags [P.], cksum 0xc606 (correct), seq 4209:4265, ack 800, win 243, options [nop,nop,TS val 96280289 ecr 1366024370], length 56
04:49:11.177971 IP (tos 0x0, ttl 64, id 22445, offset 0, flags [DF], proto TCP (6), length 107)
    ksat-api-sv-1.c.syns-sol-grdsys-internal-prod.internal.36496 > 192.146.239.16.amqps: Flags [P.], cksum 0xe298 (incorrect -> 0x499a), seq 800:855, ack 4265, win 501, options [nop,nop,TS val 1366024637 ecr 96280289], length 55
04:49:11.442818 IP (tos 0x0, ttl 35, id 16453, offset 0, flags [DF], proto TCP (6), length 93)
    192.146.239.16.amqps > ksat-api-sv-1.c.syns-sol-grdsys-internal-prod.internal.36496: Flags [P.], cksum 0xbbef (correct), seq 4265:4306, ack 855, win 243, options [nop,nop,TS val 96280355 ecr 1366024637], length 41
04:49:11.443068 IP (tos 0x0, ttl 64, id 22446, offset 0, flags [DF], proto TCP (6), length 83)
    ksat-api-sv-1.c.syns-sol-grdsys-internal-prod.internal.36496 > 192.146.239.16.amqps: Flags [P.], cksum 0xe280 (incorrect -> 0x7a16), seq 855:886, ack 4306, win 501, options [nop,nop,TS val 1366024902 ecr 96280355], length 31
04:49:11.443129 IP (tos 0x0, ttl 64, id 22447, offset 0, flags [DF], proto TCP (6), length 52)
    ksat-api-sv-1.c.syns-sol-grdsys-internal-prod.internal.36496 > 192.146.239.16.amqps: Flags [F.], cksum 0xe261 (incorrect -> 0xba94), seq 886, ack 4306, win 501, options [nop,nop,TS val 1366024902 ecr 96280355], length 0
04:49:11.713244 IP (tos 0x0, ttl 35, id 16454, offset 0, flags [DF], proto TCP (6), length 83)
    192.146.239.16.amqps > ksat-api-sv-1.c.syns-sol-grdsys-internal-prod.internal.36496: Flags [P.], cksum 0x851c (correct), seq 4306:4337, ack 887, win 243, options [nop,nop,TS val 96280423 ecr 1366024902], length 31
04:49:11.713245 IP (tos 0x0, ttl 35, id 16455, offset 0, flags [DF], proto TCP (6), length 52)
    192.146.239.16.amqps > ksat-api-sv-1.c.syns-sol-grdsys-internal-prod.internal.36496: Flags [F.], cksum 0xbb32 (correct), seq 4337, ack 887, win 243, options [nop,nop,TS val 96280423 ecr 1366024902], length 0
04:49:11.713302 IP (tos 0x0, ttl 64, id 0, offset 0, flags [DF], proto TCP (6), length 40)
    ksat-api-sv-1.c.syns-sol-grdsys-internal-prod.internal.36496 > 192.146.239.16.amqps: Flags [R], cksum 0xf07e (correct), seq 1284303842, win 0, length 0

