04:48:25.254649 IP (tos 0x0, ttl 64, id 15641, offset 0, flags [DF], proto TCP (6), length 60)
    ksat-api-sv-1.c.syns-sol-grdsys-internal-prod.internal.34206 > 192.146.239.16.5673: Flags [S], cksum 0xe269 (incorrect -> 0xeff9), seq 3673849922, win 65320, options [mss 1420,sackOK,TS val 1365978714 ecr 0,nop,wscale 7], length 0
04:48:25.519911 IP (tos 0x0, ttl 35, id 0, offset 0, flags [DF], proto TCP (6), length 60)
    192.146.239.16.5673 > ksat-api-sv-1.c.syns-sol-grdsys-internal-prod.internal.34206: Flags [S.], cksum 0xe8de (correct), seq 3214990658, ack 3673849923, win 28960, options [mss 1460,sackOK,TS val 96268874 ecr 1365978714,nop,wscale 7], length 0
04:48:25.519973 IP (tos 0x0, ttl 64, id 15642, offset 0, flags [DF], proto TCP (6), length 52)
    ksat-api-sv-1.c.syns-sol-grdsys-internal-prod.internal.34206 > 192.146.239.16.5673: Flags [.], cksum 0xe261 (incorrect -> 0x85c3), seq 1, ack 1, win 511, options [nop,nop,TS val 1365978979 ecr 96268874], length 0
04:48:25.520295 IP (tos 0x0, ttl 64, id 15643, offset 0, flags [DF], proto TCP (6), length 263)
    ksat-api-sv-1.c.syns-sol-grdsys-internal-prod.internal.34206 > 192.146.239.16.5673: Flags [P.], cksum 0xe334 (incorrect -> 0xf526), seq 1:212, ack 1, win 511, options [nop,nop,TS val 1365978979 ecr 96268874], length 211
04:48:25.788459 IP (tos 0x0, ttl 35, id 12240, offset 0, flags [DF], proto TCP (6), length 699)
    192.146.239.16.5673 > ksat-api-sv-1.c.syns-sol-grdsys-internal-prod.internal.34206: Flags [P.], cksum 0x3a53 (correct), seq 2817:3464, ack 212, win 235, options [nop,nop,TS val 96268941 ecr 1365978979], length 647
04:48:25.788460 IP (tos 0x0, ttl 35, id 12238, offset 0, flags [DF], proto TCP (6), length 2868)
    192.146.239.16.5673 > ksat-api-sv-1.c.syns-sol-grdsys-internal-prod.internal.34206: Flags [.], cksum 0xed61 (incorrect -> 0x4b15), seq 1:2817, ack 212, win 235, options [nop,nop,TS val 96268941 ecr 1365978979], length 2816
04:48:25.788503 IP (tos 0x0, ttl 64, id 15644, offset 0, flags [DF], proto TCP (6), length 64)
    ksat-api-sv-1.c.syns-sol-grdsys-internal-prod.internal.34206 > 192.146.239.16.5673: Flags [.], cksum 0xe26d (incorrect -> 0xfb7b), seq 212, ack 1, win 511, options [nop,nop,TS val 1365979248 ecr 96268874,nop,nop,sack 1 {2817:3464}], length 0
04:48:25.788526 IP (tos 0x0, ttl 64, id 15645, offset 0, flags [DF], proto TCP (6), length 52)
    ksat-api-sv-1.c.syns-sol-grdsys-internal-prod.internal.34206 > 192.146.239.16.5673: Flags [.], cksum 0xe261 (incorrect -> 0x7631), seq 212, ack 3464, win 487, options [nop,nop,TS val 1365979248 ecr 96268941], length 0
04:48:25.842473 IP (tos 0x0, ttl 64, id 15646, offset 0, flags [DF], proto TCP (6), length 178)
    ksat-api-sv-1.c.syns-sol-grdsys-internal-prod.internal.34206 > 192.146.239.16.5673: Flags [P.], cksum 0xe2df (incorrect -> 0x0e28), seq 212:338, ack 3464, win 501, options [nop,nop,TS val 1365979301 ecr 96268941], length 126
04:48:26.107345 IP (tos 0x0, ttl 35, id 12241, offset 0, flags [DF], proto TCP (6), length 103)
    192.146.239.16.5673 > ksat-api-sv-1.c.syns-sol-grdsys-internal-prod.internal.34206: Flags [P.], cksum 0xfbaf (correct), seq 3464:3515, ack 338, win 235, options [nop,nop,TS val 96269021 ecr 1365979301], length 51
04:48:26.107388 IP (tos 0x0, ttl 64, id 15647, offset 0, flags [DF], proto TCP (6), length 52)
    ksat-api-sv-1.c.syns-sol-grdsys-internal-prod.internal.34206 > 192.146.239.16.5673: Flags [.], cksum 0xe261 (incorrect -> 0x73e4), seq 338, ack 3515, win 501, options [nop,nop,TS val 1365979566 ecr 96269021], length 0
04:48:26.107630 IP (tos 0x0, ttl 64, id 15648, offset 0, flags [DF], proto TCP (6), length 89)
    ksat-api-sv-1.c.syns-sol-grdsys-internal-prod.internal.34206 > 192.146.239.16.5673: Flags [P.], cksum 0xe286 (incorrect -> 0x2ca0), seq 338:375, ack 3515, win 501, options [nop,nop,TS val 1365979567 ecr 96269021], length 37
04:48:26.408524 IP (tos 0x0, ttl 35, id 12242, offset 0, flags [DF], proto TCP (6), length 52)
    192.146.239.16.5673 > ksat-api-sv-1.c.syns-sol-grdsys-internal-prod.internal.34206: Flags [.], cksum 0x747c (correct), seq 3515, ack 375, win 235, options [nop,nop,TS val 96269097 ecr 1365979567], length 0
04:48:29.113767 IP (tos 0x0, ttl 35, id 12243, offset 0, flags [DF], proto TCP (6), length 83)
    192.146.239.16.5673 > ksat-api-sv-1.c.syns-sol-grdsys-internal-prod.internal.34206: Flags [P.], cksum 0xe4e1 (correct), seq 3515:3546, ack 375, win 235, options [nop,nop,TS val 96269773 ecr 1365979567], length 31
04:48:29.113768 IP (tos 0x0, ttl 35, id 12244, offset 0, flags [DF], proto TCP (6), length 52)
    192.146.239.16.5673 > ksat-api-sv-1.c.syns-sol-grdsys-internal-prod.internal.34206: Flags [F.], cksum 0x71b8 (correct), seq 3546, ack 375, win 235, options [nop,nop,TS val 96269773 ecr 1365979567], length 0
04:48:29.113821 IP (tos 0x0, ttl 64, id 15649, offset 0, flags [DF], proto TCP (6), length 52)
    ksat-api-sv-1.c.syns-sol-grdsys-internal-prod.internal.34206 > 192.146.239.16.5673: Flags [.], cksum 0xe261 (incorrect -> 0x64f1), seq 375, ack 3546, win 501, options [nop,nop,TS val 1365982573 ecr 96269773], length 0
04:48:29.113977 IP (tos 0x0, ttl 64, id 15650, offset 0, flags [DF], proto TCP (6), length 83)
    ksat-api-sv-1.c.syns-sol-grdsys-internal-prod.internal.34206 > 192.146.239.16.5673: Flags [P.], cksum 0xe280 (incorrect -> 0xb2d4), seq 375:406, ack 3547, win 501, options [nop,nop,TS val 1365982573 ecr 96269773], length 31
04:48:29.113996 IP (tos 0x0, ttl 64, id 15651, offset 0, flags [DF], proto TCP (6), length 52)
    ksat-api-sv-1.c.syns-sol-grdsys-internal-prod.internal.34206 > 192.146.239.16.5673: Flags [F.], cksum 0xe261 (incorrect -> 0x64d0), seq 406, ack 3547, win 501, options [nop,nop,TS val 1365982573 ecr 96269773], length 0
04:48:29.378174 IP (tos 0x0, ttl 35, id 39549, offset 0, flags [DF], proto TCP (6), length 40)
    192.146.239.16.5673 > ksat-api-sv-1.c.syns-sol-grdsys-internal-prod.internal.34206: Flags [R], cksum 0x871f (correct), seq 3214994205, win 0, length 0

